{
  "schemaVersion": "CapabilityIntentDecisionV1",
  "decisionId": "sha256:640f7a0e6d12e867d870cb2c8793da845d484c0d5691671739d4b4ed2e2897d1",
  "instructionRefId": "instruction-ref-cp3-a9c3db9f",
  "workflowIntent": "dev",
  "capabilityClass": "portableDecision",
  "capabilityFamilyId": "planning",
  "selectedPortableDecision": "plan_first",
  "confidence": "high",
  "reasonCode": "COMPLEXITY_REQUIRES_PLAN",
  "reason": "The change affects the control plane, host contracts, package consumers, and managed workspace copies.",
  "autoAuthorityRef": null,
  "appliedInvariantIds": [
    "S01",
    "S02",
    "S03",
    "S04",
    "S05",
    "S06",
    "S07",
    "CP1",
    "CP2",
    "CP3"
  ],
  "nativeEligibility": {
    "status": "ineligible",
    "leverRef": "codex|codex|planning|1.0.0",
    "evidenceState": "fresh",
    "permissionState": "safe",
    "lifecycleState": "incomplete"
  },
  "fallback": {
    "applied": true,
    "reasonCode": "NATIVE_NOT_PHASE1",
    "target": "portable",
    "retryable": false
  },
  "receipt": {
    "hostId": "codex",
    "hostSurfaceOrVariant": "codex",
    "catalogVersion": "1.0.0",
    "catalogFileDigest": "sha256:53775d5998c6398e9cd4878bb87da1ec0d5fde840918c909c217a9c60a665d05",
    "sourceHead": "ef60b2b593a232747880b86316bec6f888c7cd89",
    "decidedAt": "2026-07-24T00:55:00Z",
    "validationOwner": "host-capability-routing"
  }
}
